{
  "$schema": "../../schemas/drawio-baseline-runs.schema.json",
  "_comment": [
    "Per-scenario baseline observations captured on main HEAD before any uplift",
    "code change lands. User edits this file after running each fixture through",
    "the 04-Design agent in Copilot Chat. Run `node tools/scripts/capture-drawio-baseline.mjs`",
    "after every entry to regenerate regen-baseline.json."
  ],
  "captured_on_branch": "feat/vendor-prompting-enforcement",
  "captured_on_commit": "e5d87e8d6828e1b33964845189911e10f87f5fbd",
  "captured_at": "2026-05-05T16:07:20Z",
  "captured_by": "apex-orchestrator (G1 from session 50996f96, debug-log analysis)",
  "scenarios": {
    "g1-three-tier-web": {
      "retries": 0,
      "friction_count": 3,
      "observations": "Strict retries=0 (1 add-cells batch, 0 clear-diagram, 0 corrective edits). Friction events captured: (1) MCP infra setup [1 failed search-shapes + 6 debug terminal calls before retry succeeded]; (2) redundant finish-diagram preview before compressed export; (3) post-export palette correction via sed (#EFF6FF/#0078D4 -> #E7F5FF/#6C8EBF) instead of MCP edit-cells. Visual quality observed below 3/4 acceptance bar (rubric mean ~2.86).",
      "rubric_score": {
        "icon_correctness": 4,
        "layout": 2,
        "styling": 3,
        "semantics": 2,
        "labelling": 2,
        "type_fit": 3,
        "scalability": 4
      },
      "quality_issues": [
        "Edge-label collision: 'SqlHTTPS' visible \u2014 two parallel edges (HTTPS to Storage and SQL/TDS to Azure SQL DB) had labels overlap into a fused string. Pain point #5.",
        "Missing Managed Identity edges per prompt: prompt requires Web App -> Key Vault and Web App -> SQL via Managed Identity; only one Web App -> SQL edge rendered. Pain point #5.",
        "Application Insights and Log Analytics Workspace placed below the resource group with no zone label and no telemetry edges from Web App. No 'Observability' or cross-cutting zone visible. Pain point #4.",
        "No trust-boundary marker at the End User -> Web App public ingress. Pain point #4.",
        "Web App -> Storage and Web App -> SQL edges visually overlap before fan-out, contributing to label collision. Pain point #2."
      ]
    },
    "g2-hub-spoke-landing-zone": {
      "retries": 0,
      "friction_count": 4,
      "observations": "Strict retries=0 (1 add-cells batch, 0 clear-diagram, 0 corrective edits). Friction events captured: (1) failed read_file on references/semantic-zones.md [T-019 deferred dependency; ref does not yet exist] + 5 recovery terminal calls; (2) two search-shapes calls instead of one batched call (skill convention violated); (3) 8 terminal calls extracting placeholder XML between add-cells and finish-diagram (G1 needed 4 - extra XML mining); (4) post-export palette correction via sed (#E6F2FA -> #e6f5e6) - same pattern as G1. Improvement vs G1: single finish-diagram call (no preview+final). Source: Copilot Chat session e88ecb6b-2df2-4b73-a033-f05c8bbe3368.",
      "rubric_score": {
        "icon_correctness": 4,
        "layout": 2,
        "styling": 3,
        "semantics": 3,
        "labelling": 2,
        "type_fit": 3,
        "scalability": 3
      },
      "quality_issues": [
        "Paired-shape label collisions: 'Web App 1Web App 2', 'Key Vault (PE)Storage (PE)', 'SQL MI (PL Cosmos DB (PL)' \u2014 sibling cells in subnet groups positioned too close (same bug family as G1's SqlHTTPS edge collision). Pain points #2, #5.",
        "Trust Boundary marker positioned outside the On-Premises Network container instead of visually wrapping the perimeter \u2014 boundary intent reads as a label rather than a zone. Pain point #4.",
        "Failed dependency: agent attempted to read `references/semantic-zones.md` per prompt link, but the file does not yet exist (T-019 deferred). Surfaces as 1 friction event + 5 recovery calls. Pain point #4 (missing skill reference).",
        "Skill-convention violation: agent issued two separate `search-shapes` calls (initial 18 queries + follow-up 4 queries) instead of one batched call as required by SKILL.md. Pain point #1 (workflow drift).",
        "Palette enforcement is too late: validator catches drift only post-export; agent corrects via out-of-band `sed -i` instead of MCP `edit-cells`. Same workflow as G1. Pain point #3."
      ]
    },
    "g3-event-driven-microservices": {
      "retries": 0,
      "friction_count": 3,
      "observations": "Strict retries=0 (1 add-cells batch with 24 cells, 0 clear-diagram, 0 corrective edits). Friction events: (1) THREE search-shapes calls (9+4+3 queries) instead of one batch \u2014 skill-convention drift worsening vs G2 (which had 2); (2) post-export palette correction via sed (#e6f2fa -> #dae8fc) \u2014 same pattern as G1/G2; (3) create_file at [25] writing an artifact outside the standard save-drawio.py flow. Improvements: only 2 XML-mining calls between add-cells and finish-diagram (G1=3, G2=8). Sequence type correctly identified \u2014 legend correctly omitted per OQ-2 carve-out. Source: Copilot Chat session 16bcee18-21df-4f58-8228-8a26bb005a65.",
      "rubric_score": {
        "icon_correctness": 4,
        "layout": 1,
        "styling": 3,
        "semantics": 3,
        "labelling": 1,
        "type_fit": 4,
        "scalability": 3
      },
      "quality_issues": [
        "REGRESSION (Layout 1/4): 50% of canvas empty \u2014 App Insights + Log Analytics floating bottom-left with no observability zone, no telemetry edges from any Container App. Same floating cross-cutting pattern as G1. Pain point #2, #4.",
        "REGRESSION (Labelling 1/4): Multiple fused edge labels \u2014 'HTTPS / OAuth2HTTPS / OAuth2' (Client->APIM and APIM->orders-api parallel labels merged), 'AMQPAMQPHTTPS :443' (3-way merge), 'HTTPS :443LS :6380' (TLS truncated/merged with port). This is the SqlHTTPS bug from G1 amplified across multiple parallel edges. Pain point #5, #2.",
        "WRONG EDGE TARGET: 'change feed' edge drawn from Cosmos DB to Redis Cache (should target Event Grid per prompt). Indicates agent loses semantic intent during edge layout. Pain point #5 (semantic correctness).",
        "Skill-convention drift WORSENING: 3 separate search-shapes calls (G1=2, G2=2, G3=3) \u2014 agent is splitting batches more, not less. Pain point #1 (workflow drift).",
        "Trust boundary missing at APIM public ingress per prompt. Pain point #4.",
        "Bright side: Type-fit 4/4 \u2014 agent correctly identified sequence/runtime type and applied logical zones (Ingress/Processing/Persistence) instead of forcing VNet/network template. Validates the eventual T-015/T-016 type-dispatch design."
      ]
    },
    "g4-ml-training-pipeline": {
      "retries": 0,
      "friction_count": 4,
      "observations": "Strict retries=0 (1 add-cells batch with 16 cells; the edit-cells at [12] is a pre-batch group-label correction, not a retry under the rule). Friction events: (1) FOUR search-shapes calls (10+8+6+7=31 queries) \u2014 drift continues monotonically G1=2 G2=2 G3=3 G4=4; (2) group-label correction via edit-cells after create-groups (forgot to set titles); (3) multiple python XML-extraction round-trips between add-cells and add-cells-to-group; (4) post-export palette correction via Python re.sub (escalation from sed) \u2014 same chronic pattern. Improvements: first scenario to use create-groups + add-cells-to-group containment workflow (proper). Source: Copilot Chat session cbc7eb7b-872b-44af-ac07-82249a9051e4.",
      "rubric_score": {
        "icon_correctness": 3,
        "layout": 1,
        "styling": 3,
        "semantics": 2,
        "labelling": 1,
        "type_fit": 3,
        "scalability": 3
      },
      "quality_issues": [
        "REGRESSION (Labelling 1/4): 'AMIAML SDKace' triple-label fusion on the AML Workspace icon \u2014 three separate labels overlapped into a single illegible string. This is the worst label collision observed across G1-G4 and confirms the pattern is amplifying with workflow complexity (groups + edges + multiple resources at one point). Pain point #5.",
        "REGRESSION (Layout 1/4): 60% of canvas empty. Cross-cutting items (Key Vault, Application Insights, Log Analytics) placed in a useless mid-zone with no observability container, no trust boundary, no edges to compute. Same pattern as G1/G3, more pronounced. Pain points #2, #4.",
        "Variant requirement partly met: GPU Cluster labelled '(A100)', ADLS Gen2 labelled '(HNS)', ACR labelled 'Premium' \u2014 variant info is in TEXT labels but icons themselves are generic family icons. Rubric anchor 3/4: 'correct families, but stale icon-set version' applies. Pain point #1.",
        "Missing zones: prompt expected 'ML Workspace' and 'Data Zone' (delivered) but security/observability zone for KV+AI+LA absent. Pain point #4.",
        "Skill-convention drift WORSENING: search-shapes call counts G1=2, G2=2, G3=3, G4=4 \u2014 strictly monotonic. Each scenario splits batches more than the last. SKILL.md 'single batch' rule is being eroded as scenario complexity increases. Pain point #1 (workflow drift).",
        "Bright spots: (a) first scenario to use create-groups + add-cells-to-group containment workflow correctly, (b) best legend yet \u2014 accurately enumerates variant rationale (GPU=A100, ADLS=Gen2, ACR=Premium) and edge meanings (AML SDK / ABFS / Pull). Validates T-021 + T-028 legend design."
      ]
    },
    "g5-enterprise-landing-zone": {
      "retries": 1,
      "friction_count": 5,